2023,A couple of counterparts,LA459457_74417.jpg,"Boucher, François;Birth 1703.09.29, Paris;Death 1770.05.30, Paris;Place of activity Paris, Rom",1750 (um),Oil: canvas / painted,44.00 cm,"Herbert M. Gutmann, Potsdam - Herbertshof, from his collection auction Paul Graupe April 12-14, 1934, lot 2;2023 conclusion of a settlement between claimants and current owner;Read more;Read less","Berlin, 1934","amicable settlement;Literature / Source;Auktionskatalog Paul Graupe, Versteigerung 132, Sammlung Herbert M. Gutmann, Herbertshof bei Potsdam - Gemälde, meist aus dem 18. Jahrhundert, Möbel, Silber, Porzellan, Textilien, Alte syrische Gläser, Ostasiatische und islamische Kleinkunst, Berlin, 12.-14.04.1934;Read more;Read less",23.03.2021,Olaf S. Ossmann Rechtsanwalt office@ossmann.ch,"Gutmann, Herbert M.",https://www.lostart.de/en/Verlust/594394,"Auktionskatalog Paul Graupe, Versteigerung 132, Sammlung Herbert M. Gutmann, Herbertshof bei Potsdam - Gemälde, meist aus dem 18. Jahrhundert, Möbel, Silber, Porzellan, Textilien, Alte syrische Gläser, Ostasiatische und islamische Kleinkunst, Berlin, 12.-14.04.1934;Read more"
2018,Kiddush Cup,LA457085_72545.jpg,Unknown (östliche Treibarbeit | eastern repoussé work),1757,"silver / repoussé work, gilded",9.30 cm,"Probably until 1939 Collection Max Raphael Hahn, Göttingen/Hamburg, [...], Transferred in 1960 by the Finanzbehörde Hamburg to the Museum für Kunst und Gewerbe Hamburg, Restituted to the heirs of Max Raphael Hahn on November 7, 2018.;Read more;Read less",,"restituted;Literature / Source;NLA HA, Nds. 720 Göttingen, Acc. 2009/129, Nr. 1281, Bl. 1-15, Judaica-Sammlung Max R. Hahn, Göttingen.;Read more;Read less",11.08.2020,Please contact the German Lost Art Foundation.,"Hahn, Max Raphael",https://www.lostart.de/en/Verlust/590885,"NLA HA, Nds. 720 Göttingen, Acc. 2009/129, Nr. 1281, Bl. 1-15, Judaica-Sammlung Max R. Hahn, Göttingen.;Read more"
2012,Vase of Flowers,LA23220_43142.jpg,"Ast, Balthasar van der;Birth 1593.06.30/1594.09.13, Middelburg;Death (vor) 1657.12.19, Delft;Place of activity Utrecht, Delft, Bergen-op-Zoom",,Oil: copper / painted,33.00 cm,"Claimant’s parents were arrested in Berlin on July 1942, at which time they still had possession of six of their paintings while and another six were in storage in Hamburg (awaiting shipment to the U.S.). They were deported to Theresienstadt, and all twelve paintings were confiscated by the Gestapo. 2012;Read more;Read less","Berlin / oder Hamburg, 1942",restituted,2008,HCPO Holocaust Claims Processing Office claimsques@dfs.ny.gov,"Hartog, Paul",https://www.lostart.de/en/Verlust/409373,
,Pineapple,,"Slevogt, Max;Birth 1868.10.08, Landshut;Death 1932.09.20, Neukastel (Pfalz);Place of activity München, Neukastel (Pfalz)",,Oil: canvas / painted,59.00 cm,"Collection Fritz and Alice Hermann, Berlin, October 20 and 21, 1936 Auction House Paul Graupe, Berlin, cat.-no. 81a, proceeds of sale were used to finance the Reichsfluchtsteuer and emigration, whereabouts unknown;Read more;Read less","Berlin / Auktion, 1936",restituted,06.02.2018,"Raue LLP, Berlin Dr. Felix Stang, LL.M. Phone +49 (0) 30 818 550 308 felix.stang@raue.com","Hermann, Fritz und Alice",https://www.lostart.de/en/Verlust/574860,
2020,Ex libris Hans Herxheimer,LA456628_72087.jpg,"Thoma, Hans;Birth 1839.10.02, Bernau (Schwarzwald);Death 1924.11.07, Karlsruhe;Place of activity Karlsruhe, Frankfurt (Main), München, Schaffhausen, Säckingen, Paris",,printed (wood engraving),9.00 cm,"Hans Herxheimer, Frankfurt/M., [...], private property southern Germany;June 2020 Restitution to the heirs;Read more;Read less",,restituted,17.06.2020,Dr. Monika Tatzkow Wissenschaftlicher Dokumentationsdienst Phone +49 (0) 30 64 128 13 tatzkow@t-online.de,"Herxheimer, Hans",https://www.lostart.de/en/Verlust/589493,
2009,Sowing farmer / Le Semeur à Montfoucault / Semeur et Laboureur,LA16260_40793.jpg,"Pissarro, Camille Jacob;Birth 1831.07.10, St. Thomas (West-Indien);Death 1903.11.13, Paris;Place of activity Paris, Montmorency, La Varenne-St.Hilaire, Pontoise, London, Eragny",1875 (um),Oil: Canvas,48.00 cm,"1997 sold at Sotheby`s New York, 2009 amicable agreement with the heirs;external link;Read more;Read less","Leipzig, 1939",amicable settlement,2006,Christian Hinrichsen christian.hinrichsen@gmail.com,"Hinrichsen, Dr. Henri",https://www.lostart.de/en/Verlust/318013,
2020,Fishermen at Lake Chiemsee,LA453907_69568.jpg,"Wopfner, Joseph;Birth 1843.03.19, Schwaz;Death 1927.07.22 / 1927.07.23, München;Place of activity München",1884,Oil: canvas / painted,50.00 cm,"Abraham Adelsberger, Nuremberg (until 1933), from 07.11.1933 Alfred Isay, Cologne, 23.11.1933 Lempertz auction, Cologne, lot 239 (not sold), on 08.02.1934 back to Alfred Isay, [...] - due to the fate of the aggrieved party, Nazi persecution-related deprivation cannot be ruled out, the exact circumstances of loss are unclear, presumably purchased by Martin Bormann for Hitler in 1942, 25.10.1945 handed over to German authorities by American allies;2020 restitution to the heirs;Read more;Read less","Köln, 1934",restituted,30.01.2019,Nathan Scheftelowitz Adv. & Notary Phone +972-3-6091587/9 nns@inter.net.il,"Isay, Alfred",https://www.lostart.de/en/Verlust/581548,
2022,Reading Woman (Mrs Corinth),LA13207_39900.jpg,"Corinth, Lovis;Birth 1858.07.21, Tapiau (Ost-Preußen);Death 1925.07.17, Zandvoort;Place of activity Königsberg, Berlin",1911,Oil: Canvas / painted,50.00 cm,"Emil Kaim, Breslau, 1940 confiscation, 1942 Schlesisches Museum der Bildenden Künste, Breslau, 1944 auction by the Deutsche Treuhandstelle for confiscated Jewish, Polish and other property in the Generalgouvernement, German private property;2022 amicable settlement;Read more;Read less","Breslau / Beschlagnahme, Wrocław, 1940","amicable settlement;Literature / Source;Charlotte Berend-Corinth, Lovis Corinth. Die Gemälde. Werkverzeichnis, 2. neubearbeitete Auflage, München 1992, Nr. 458;Read more;Read less",2005,Dr. Monika Tatzkow Wissenschaftlicher Dokumentationsdienst Phone +49 (0) 30 64 128 13 tatzkow@t-online.de,"Kaim, Emil",https://www.lostart.de/en/Verlust/310436,"Charlotte Berend-Corinth, Lovis Corinth. Die Gemälde. Werkverzeichnis, 2. neubearbeitete Auflage, München 1992, Nr. 458;Read more"
,Bauernsturm,,"Kollwitz, Käthe;Birth 1867.07.08, Königsberg;Death 1945.04.22, Moritzburg;Place of activity Berlin",,Kreide,,,"Leipzig, 1939",restituted,2001,"Ellen R. Werther, Esq. Ressler & Ressler Phone +1 212 695 6446 ewerther@resslerlaw.com","Kirstein, Dr. Gustav & Clara",https://www.lostart.de/en/Verlust/237924,
,Portrait of princess Wilhelmine von Preußen,,"Tischbein, Johannes Heinrich Title Portrait of princess Wilhelmine von Preußen Additional title also small female portrait Object type Painting Group of reported objects Painting Material / Technique painted;Height 27.00 cm;Width 21.00 cm;Description;Reference: US - NARA, RG 260, A3389. Records Concerning the Central Collecting Points (""Ardelia Hall Collection""): Selected Microfilm Reproductions And Related Records, 1945-1949. Roll 66. ""Linz Film"". 14.3, Vols. 8a–11a. LF/X/25/129. Blatt 134.;Read more;Read less;Provenance;Collection Viktor von Klemperer, - 30.04.1937;Auction Walter Achenbach, Berlin 30.04.1937, not sold;RA Dr. jur. Wilhelm Mielck, Mai 1942;Staatliche GemäldeCollection Dresden, - Oktober 1943 -;Restituted in 1991.;Read more;Read less;Status;restituted;Published since 27.01.2016",,painted,27.00 cm,"Collection Viktor von Klemperer, - 30.04.1937;Auction Walter Achenbach, Berlin 30.04.1937, not sold;RA Dr. jur. Wilhelm Mielck, Mai 1942;Staatliche GemäldeCollection Dresden, - Oktober 1943 -;Restituted in 1991.;Read more;Read less",,restituted,27.01.2016,Dr. Sabine Rudolph Rechtsanwältin Phone +49 (0)351 317220 rudolph@heimann-dresden.de,"Klemperer, Dr. Victor von",https://www.lostart.de/en/Verlust/531532,
,Portrait of princess Wilhelmine von Preußen,,"Tischbein, Johannes Heinrich Title Portrait of princess Wilhelmine von Preußen Additional title also small female portrait Object type Painting Group of reported objects Painting Material / Technique painted;Height 27.00 cm;Width 21.00 cm;Description;Reference: US - NARA, RG 260, A3389. Records Concerning the Central Collecting Points (""Ardelia Hall Collection""): Selected Microfilm Reproductions And Related Records, 1945-1949. Roll 66. ""Linz Film"". 14.3, Vols. 8a–11a. LF/X/25/129. Blatt 134.;Read more;Read less;Provenance;Collection Viktor von Klemperer, - 30.04.1937;Auction Walter Achenbach, Berlin 30.04.1937, not sold;RA Dr. jur. Wilhelm Mielck, Mai 1942;Staatliche GemäldeCollection Dresden, - Oktober 1943 -;Restituted in 1991.;Read more;Read less;Status;restituted;Published since 27.01.2016",,painted,27.00 cm,"Collection Viktor von Klemperer, - 30.04.1937;Auction Walter Achenbach, Berlin 30.04.1937, not sold;RA Dr. jur. Wilhelm Mielck, Mai 1942;Staatliche GemäldeCollection Dresden, - Oktober 1943 -;Restituted in 1991.;Read more;Read less",,restituted,27.01.2016,Dr. Sabine Rudolph Rechtsanwältin Phone +49 (0)351 317220 rudolph@heimann-dresden.de,"Klemperer, Dr. Victor von",https://www.lostart.de/en/Verlust/531532,
2019,View of a Dutch town square,LA11362_38751.jpg,"Heide, Johannes van der (Jan van der Heyden);Birth 1878.11.05, Amsterdam;Place of activity München, Graßlfing (Ober-Bayern)",,,,2019 restitution to heirs;Read more;Read less,"Wien, Vienna, 1941",restituted,2004,Israelitische Kultusgemeinde Wien Abteilung für Restitutionsangelegenheiten der IKG Wien Phone +43 (1) 531 04 201 restitution@ikg-wien.at,"Kraus, Konsul Gottlieb Bohumil und Mathilde",https://www.lostart.de/en/Verlust/302077,
2016,Römischer Kinder-Sarkophag,LA439089_54820.jpg,Unknown (Römisch),,Marble,43.00 cm,"Collection Rudolf Mosse, auction, Berlin (Rudolf Lepke's Kunst-Auktion-Haus), 1934-5-29. Kat.Nr.132, 2015 restitution to the Mosse Foundation, 2016 repurchase by the Staatliche Museen zu Berlin - collection: Antikensammlung;Read more;Read less","Berlin, 1934",restituted,03.07.2014,"J. Eric Bartko (Director of Investigations) Bartko, Zankel, Bunzel & Miller (www.bzbm.com) ebartko@bzbm.com","Lachmann-Mosse, Hans",https://www.lostart.de/en/Verlust/519166,
2016,Junge Frau,LA439026_54757.jpg,Unknown (Ägyptisch),,Wood / painted,18.00 cm,"Sammlung Rudolf Mosse, Versteigerung, Berlin (Rudolf Lepke's Kunst-Auktion-Haus), 1934-5-29. Kat.Nr.157, 2016 Restitution (Settlement with the University of Zurich);Read more;Read less","Berlin, 1934",restituted,03.07.2014,"J. Eric Bartko (Director of Investigations) Bartko, Zankel, Bunzel & Miller (www.bzbm.com) ebartko@bzbm.com","Lachmann-Mosse, Hans",https://www.lostart.de/en/Verlust/519077,
,Scholastica,LA438997_54728.jpg,"Blechen, Karl;Birth 1798.07.29, Cottbus;Death 1840.07.23, Berlin;Place of activity Berlin",1832,Canvas / painted,246.00 cm,"Sammlung Rudolf Mosse, Versteigerung, Berlin (Rudolf Lepke's Kunst-Auktion-Haus), 1934-5-29. Kat.Nr.12;Read more;Read less","Berlin, 1934",restituted,03.07.2014,"J. Eric Bartko (Director of Investigations) Bartko, Zankel, Bunzel & Miller (www.bzbm.com) ebartko@bzbm.com","Lachmann-Mosse, Hans",https://www.lostart.de/en/Verlust/518979,
2018,Der kleine Bacchus und die Windgötter,LA439001_54732.jpg,"Feuerbach, Anselm;Birth 1829.09.12, Speyer;Death 1880.01.04, Venedig;Place of activity Rom, Wien, Venedig",1848,Canvas / painted,120.00 cm,"Sammlung Rudolf Mosse, Versteigerung, Berlin (Rudolf Lepke's Kunst-Auktion-Haus), 1934-5-29. Kat.Nr.27, in 2018 restituted to the heirs, until further notice as a loan from the heirs in the Kunsthaus Heylshof in Worms;Read more;Read less","Berlin, 1934",restituted,03.07.2014,"J. Eric Bartko (Director of Investigations) Bartko, Zankel, Bunzel & Miller (www.bzbm.com) ebartko@bzbm.com","Lachmann-Mosse, Hans",https://www.lostart.de/en/Verlust/518992,
,Frühlingssturm,LA439003_54734.jpg,"Hofmann, Ludwig von (1861);Birth 1861.08.17, Darmstadt;Death 1945.08.23, Pillnitz;Place of activity Dresden, Berlin, Rom, Weimar",1881/1930,Canvas / painted,138.00 cm,"Sammlung Rudolf Mosse, Versteigerung, Berlin (Rudolf Lepke's Kunst-Auktion-Haus), 1934-5-29. Kat.Nr.41;Read more;Read less","Berlin, 1934",restituted,03.07.2014,"J. Eric Bartko (Director of Investigations) Bartko, Zankel, Bunzel & Miller (www.bzbm.com) ebartko@bzbm.com","Lachmann-Mosse, Hans",https://www.lostart.de/en/Verlust/519004,
2016,Bildnis des Appellationssrats Stenglein,LA439007_54738.jpg,"Leibl, Wilhelm Maria Hubertus;Birth 1844.10.23, Köln;Death 1900.12.04, Würzburg;Place of activity München, Paris, Graßlfing (Ober-Bayern), Unterschondorf, Berbling, Aibling, Kutterling",1871,Canvas / painted,49.50 cm,"Sammlung Rudolf Mosse, Versteigerung, Berlin (Rudolf Lepke's Kunst-Auktion-Haus), 1934-5-29. Kat.Nr.50, 2016 restitution;Read more;Read less","Berlin, 1934",restituted,03.07.2014,"J. Eric Bartko (Director of Investigations) Bartko, Zankel, Bunzel & Miller (www.bzbm.com) ebartko@bzbm.com","Lachmann-Mosse, Hans",https://www.lostart.de/en/Verlust/519012,
2016,Der Gang nach Bethlehem,LA439018_54749.jpg,"Uhde, Fritz von;Birth 1848.05.22, Wolkenburg;Death 1911.02.25, München;Place of activity München, Dresden, Borna (Leipzig), Leipzig, Starnberg",1865/1900,Canvas / painted,88.00 cm,"Sammlung Rudolf Mosse, Versteigerung, Berlin (Rudolf Lepke's Kunst-Auktion-Haus), 1934-5-29. Kat.Nr.98, 2016 Restitution an die Erben;Read more;Read less","Berlin, 1934",restituted,03.07.2014,"J. Eric Bartko (Director of Investigations) Bartko, Zankel, Bunzel & Miller (www.bzbm.com) ebartko@bzbm.com","Lachmann-Mosse, Hans",https://www.lostart.de/en/Verlust/519051,
2016,Bärtiger Mann,LA439025_54756.jpg,Unknown (Ägyptisch),,Wood / painted,18.00 cm,"Sammlung Rudolf Mosse, Versteigerung, Berlin (Rudolf Lepke's Kunst-Auktion-Haus), 1934-5-29. Kat.Nr.156, 2016 restitution (settlement with the University of Zurich);Read more;Read less","Berlin, 1934",restituted,03.07.2014,"J. Eric Bartko (Director of Investigations) Bartko, Zankel, Bunzel & Miller (www.bzbm.com) ebartko@bzbm.com","Lachmann-Mosse, Hans",https://www.lostart.de/en/Verlust/519076,
2019,Die büßende Magdalena,,Unknown (Werkstatt von Peter Paul Rubens),1600/1640,Oil: Canvas / painted,115.00 cm,"Sammlung Rudolf Mosse, Versteigerung, Berlin (Rudolf Lepke's Kunst-Auktion-Haus), 1934-5-29. Kat.No. 180c, 2019 restitution;Read more;Read less","Berlin, 1934",restituted,03.07.2014,"J. Eric Bartko (Director of Investigations) Bartko, Zankel, Bunzel & Miller (www.bzbm.com) ebartko@bzbm.com","Lachmann-Mosse, Hans",https://www.lostart.de/en/Verlust/519080,
2015,Opferbecken,,Unknown (Altes Reich),,limestone,31.50 cm,"Collection Rudolf Mosse, auction, Berlin (Rudolf Lepke's Kunst-Auktion-Haus), 1934-5-29. Kat.No. 158a, 2015 restitution;Read more;Read less",,restituted,03.07.2014,"J. Eric Bartko (Director of Investigations) Bartko, Zankel, Bunzel & Miller (www.bzbm.com) ebartko@bzbm.com","Lachmann-Mosse, Hans",https://www.lostart.de/en/Verlust/520378,
2015,Eingeweidekrug,,"Unknown (Ägyptisch, Spätzeit)",,alabaster,26.00 cm,"Collection Rudolf Mosse, auction, Berlin (Rudolf Lepke's Kunst-Auktion-Haus), 1934-5-29. Kat.No. 159, 2015 restitution;Read more;Read less",,restituted,03.07.2014,"J. Eric Bartko (Director of Investigations) Bartko, Zankel, Bunzel & Miller (www.bzbm.com) ebartko@bzbm.com","Lachmann-Mosse, Hans",https://www.lostart.de/en/Verlust/520379,
2019,Im Wirtshaus,LA439002_54733.jpg,"Grützner, Eduard;Birth 1846.05.26, Großkarlowitz (Neiße);Death 1925.04.02, München;Place of activity München",1898,Canvas / painted,57.00 cm,"Rudolf Mosse Collection, Auction, Berlin (Rudolf Lepke's Art Auction House), 1934-5-29 Cat.No.35, October 10, 2019 restitution to the heirs;Read more;Read less","Berlin, 1934",restituted,03.07.2014,"J. Eric Bartko (Director of Investigations) Bartko, Zankel, Bunzel & Miller (www.bzbm.com) ebartko@bzbm.com","Lachmann-Mosse, Hans",https://www.lostart.de/en/Verlust/518999,
2018,Self portrait,,"Stauffer-Bern, Karl;Birth 1857.09.02, Trubschachen;Death 1891.01.24, Florenz;Place of activity Berlin, Rom, Bern",1883,pencil / drawn,26.00 cm,"Collection Rudolf Mosse, auction, Berlin (Rudolf Lepke's Kunst-Auktion-Haus), 1934-5-29. Kat.Nr. 92, 2018 restituted to the heirs of Rudolf Mosse;Read more;Read less","Berlin, 1934",restituted,03.07.2014,"J. Eric Bartko (Director of Investigations) Bartko, Zankel, Bunzel & Miller (www.bzbm.com) ebartko@bzbm.com","Lachmann-Mosse, Hans",https://www.lostart.de/en/Verlust/519156,
,Büste,LA439147_54878.jpg,Unknown (Benin),,"bronze, wood",54.00 cm,"Collection Rudolf Mosse, auction, Berlin (Rudolf Lepke's Kunst-Auktion-Haus), 1934-5-29. Kat.Nr.178.;Read more;Read less",,restituted,03.07.2014,"J. Eric Bartko (Director of Investigations) Bartko, Zankel, Bunzel & Miller (www.bzbm.com) ebartko@bzbm.com","Lachmann-Mosse, Hans",https://www.lostart.de/en/Verlust/520526,
2019,Dichter Wald im Frühling,,"Schindler, Emil Jacob;Birth 1842.04.27, Wien;Death 1892.08.09, Westerland (Sylt);Place of activity Plankenberg, Wien, Goisern",1887,Wood / painted,50.00 cm,"Rudolf Mosse Collection, Auction, Berlin (Rudolf Lepke's Art Auction House), 1934-5-29 Cat. No.87, 2019 restituted;Read more;Read less","Berlin, 1934",restituted,03.07.2014,"J. Eric Bartko (Director of Investigations) Bartko, Zankel, Bunzel & Miller (www.bzbm.com) ebartko@bzbm.com","Lachmann-Mosse, Hans",https://www.lostart.de/en/Verlust/519042,
2023,Nile Landscape near Philã,,"Körner, Ernst;Birth 1864.11.03, Stibbe;Death 1927.07.30, Berlin",1865/1930,canvas / painted,45.00 cm,"Collection Rudolf Mosse, auction, Berlin (Auktions-Haus ""Union"") 1934-6-6, Kat. Nr. 239;April 2023 restitution to the heirs;Read more;Read less","Berlin, 1934",restituted,16.07.2014,"J. Eric Bartko (Director of Investigations) Bartko, Zankel, Bunzel & Miller (www.bzbm.com) ebartko@bzbm.com","Lachmann-Mosse, Hans",https://www.lostart.de/en/Verlust/520627,
2023,Nile Landscape near Philã,,"Körner, Ernst;Birth 1864.11.03, Stibbe;Death 1927.07.30, Berlin",1865/1930,canvas / painted,45.00 cm,"Collection Rudolf Mosse, auction, Berlin (Auktions-Haus ""Union"") 1934-6-6, Kat. Nr. 239;April 2023 restitution to the heirs;Read more;Read less","Berlin, 1934",restituted,16.07.2014,"J. Eric Bartko (Director of Investigations) Bartko, Zankel, Bunzel & Miller (www.bzbm.com) ebartko@bzbm.com","Lachmann-Mosse, Hans",https://www.lostart.de/en/Verlust/520627,
2020,Back view of a walking man,LA415416_45399.jpg,"Liebermann, Max;Birth 1847.07.20, Berlin;Death 1935.02.08, Berlin;Place of activity Berlin",1887 (um),black charcoal: paper (chequered) / drawn,21.10 cm,"Max Liebermann, Martha Liebermann Berlin, loss after 1935, Kohl-Weigand Collection, 1982 Saarland Museum;2020 amicable settlement with the heirs;Read more;Read less",,"amicable settlement;Literature / Source;Liebermann, Zeichnen heißt weglassen, 2004/2005, Nr. 28;Read more;Read less",2010,Dr. Monika Tatzkow Wissenschaftlicher Dokumentationsdienst Phone +49 (0) 30 64 128 13 tatzkow@t-online.de,"Liebermann, Martha und Max",https://www.lostart.de/en/Verlust/417885,"Liebermann, Zeichnen heißt weglassen, 2004/2005, Nr. 28;Read more"
2014,"Interior with ironing woman / ""Plätterin""",LA422211_50626.jpg,"Liebermann, Max;Birth 1847.07.20, Berlin;Death 1935.02.08, Berlin;Place of activity Berlin",1884,Oil: cardboard / painted,47.50 cm,"Max Liebermann, Martha Liebermann Berlin, loss after 1935, private property Berlin;2014 amicable settlement, auction Villa Grisebach 2014;Read more;Read less",,"amicable settlement;Literature / Source;M. Eberle, Werkverzeichnis Max Liebermann, Nr. 1884/9;Read more;Read less",12.03.2012,Dr. Monika Tatzkow Wissenschaftlicher Dokumentationsdienst Phone +49 (0) 30 64 128 13 tatzkow@t-online.de,"Liebermann, Martha und Max",https://www.lostart.de/en/Verlust/452434,"M. Eberle, Werkverzeichnis Max Liebermann, Nr. 1884/9;Read more"
2020,Martha and granddaughter Maria,,"Liebermann, Max;Birth 1847.07.20, Berlin;Death 1935.02.08, Berlin;Place of activity Berlin",,pencil / drawn,16.00 cm,"Max Liebermann, Martha Liebermann Berlin, loss after 1935, Kohl-Weigand Collection, 1982 Saarland Museum;2020 amicable settlement with the heirs;Read more;Read less",,"amicable settlement;Literature / Source;H.-J. Imiela, Sammlung Kohl-Weigand, 1970, Nr. 98;Read more;Read less",2010,Dr. Monika Tatzkow Wissenschaftlicher Dokumentationsdienst Phone +49 (0) 30 64 128 13 tatzkow@t-online.de,"Liebermann, Martha und Max",https://www.lostart.de/en/Verlust/417872,"H.-J. Imiela, Sammlung Kohl-Weigand, 1970, Nr. 98;Read more"
2021,"Fish still life, also ""Fleischerbank""",LA422210_50625.jpg,"Liebermann, Max;Birth 1847.07.20, Berlin;Death 1935.02.08, Berlin;Place of activity Berlin",1877,Oil: wood / painted,17.50 cm,"Max Liebermann, Martha Liebermann Berlin, loss after 1937;2021 amicable settlement with the heirs;Read more;Read less",,"amicable settlement;Literature / Source;M. Eberle, Werkverzeichnis Max Liebermann, Nr. 1877/7;Read more;Read less",12.03.2012,Dr. Monika Tatzkow Wissenschaftlicher Dokumentationsdienst Phone +49 (0) 30 64 128 13 tatzkow@t-online.de,"Liebermann, Martha und Max",https://www.lostart.de/en/Verlust/452433,"M. Eberle, Werkverzeichnis Max Liebermann, Nr. 1877/7;Read more"
2020,Overgrown dune,LA415405_45388.jpg,"Liebermann, Max;Birth 1847.07.20, Berlin;Death 1935.02.08, Berlin;Place of activity Berlin",1910 (um),black charcoal: page from a skaetchbook / drawn,10.40 cm,"Max Liebermann, Martha Liebermann Berlin, loss after 1935, Kohl-Weigand Collection, 1982 Saarland Museum;2020 amicable settlement with the heirs;Read more;Read less",,"amicable settlement;Literature / Source;H.-J. Imiela, Sammlung Kohl-Weigand, 1970, Nr. 60;Read more;Read less",2010,Dr. Monika Tatzkow Wissenschaftlicher Dokumentationsdienst Phone +49 (0) 30 64 128 13 tatzkow@t-online.de,"Liebermann, Martha und Max",https://www.lostart.de/en/Verlust/417873,"H.-J. Imiela, Sammlung Kohl-Weigand, 1970, Nr. 60;Read more"
2020,Maria (Liebermann's granddaughter) with nanny,LA415403_45386.jpg,"Liebermann, Max;Birth 1847.07.20, Berlin;Death 1935.02.08, Berlin;Place of activity Berlin",1919 (um),pen in brown: paper / drawn,17.50 cm,"Max Liebermann, Martha Liebermann Berlin, loss after 1935, Kohl-Weigand Collection, 1982 Saarland Museum;2020 amicable settlement with the heirs;Read more;Read less",,"amicable settlement;Literature / Source;H.-J. Imiela, Sammlung Kohl-Weigand, 1970, Nr. 80;Read more;Read less",2010,Dr. Monika Tatzkow Wissenschaftlicher Dokumentationsdienst Phone +49 (0) 30 64 128 13 tatzkow@t-online.de,"Liebermann, Martha und Max",https://www.lostart.de/en/Verlust/417870,"H.-J. Imiela, Sammlung Kohl-Weigand, 1970, Nr. 80;Read more"
2023,The artist's wife and daughter writing at the table,LA415413_45396.jpg,"Liebermann, Max;Birth 1847.07.20, Berlin;Death 1935.02.08, Berlin;Place of activity Berlin",1902,charcoal / drawn,17.40 cm,"Max Liebermann, Martha Liebermann Berlin, loss after 1935, private property Berlin;January 2023 amicable settlement;Read more;Read less",,"amicable settlement;Literature / Source;Max Liebermann in seiner Zeit, 1979/80, Nr. 322;Read more;Read less",2010,Dr. Monika Tatzkow Wissenschaftlicher Dokumentationsdienst Phone +49 (0) 30 64 128 13 tatzkow@t-online.de,"Liebermann, Martha und Max",https://www.lostart.de/en/Verlust/417881,"Max Liebermann in seiner Zeit, 1979/80, Nr. 322;Read more"
,The granddaughter in the basket chair to the right,LA415424_45407.jpg,"Liebermann, Max;Birth 1847.07.20, Berlin;Death 1935.02.08, Berlin;Place of activity Berlin",1920,Oil: canvas / painted,51.50 cm,"Max Liebermann, Martha Liebermann Berlin, Verlust nach 1935, C. Doebbeke, Kunsth. Nicolai, Lempertz (28.10.1958), Ketterer (29./30.05.1959), Christie's London (17.10.2000), Lot 43;Read more;Read less","Berlin, 1935 (nach)","amicable settlement;Literature / Source;M. Eberle, Werkverzeichnis Max Liebermann, Nr. 1920/30;Read more;Read less",2010,Dr. Monika Tatzkow Wissenschaftlicher Dokumentationsdienst Phone +49 (0) 30 64 128 13 tatzkow@t-online.de,"Liebermann, Martha und Max",https://www.lostart.de/en/Verlust/417896,"M. Eberle, Werkverzeichnis Max Liebermann, Nr. 1920/30;Read more"
2021,Jesus unter den Schriftgelehrten,LA436737_52457.jpg,"Menzel, Adolph;Birth 1815.12.08, Breslau;Death 1905.02.09, Berlin;Place of activity Berlin",1852,drawn,42.00 cm,"Max Liebermann (1847-1935), from 1935 Martha Liebermann (1857-1943), Berlin - Galerie Wolfgang Gurlitt, Berlin/Münchern - Collection (?) Briegleb, Munich - Purchased in 1960 by Dr. Georg Schäfer - Since 1997 Collection-Dr.-Georg-Schäfer-Stiftung - 2021 amicable settlement of the Collection-Dr.-Georg-Schäfer-Stiftung with the Liebermann estate.;Read more;Read less","Berlin, 1935 (nach)",amicable settlement,25.07.2013,Dr. Monika Tatzkow Wissenschaftlicher Dokumentationsdienst Phone +49 (0) 30 64 128 13 tatzkow@t-online.de,"Liebermann, Martha und Max",https://www.lostart.de/en/Verlust/475956,
2020,Maria (Liebermann's granddaughter),LA415404_45387.jpg,"Liebermann, Max;Birth 1847.07.20, Berlin;Death 1935.02.08, Berlin;Place of activity Berlin",1919 (um),pen / drawn,14.20 cm,"Max Liebermann, Martha Liebermann Berlin, loss after 1935, Kohl-Weigand Collection, 1982 Saarland Museum;2020 amicable settlement with the heirs;Read more;Read less",,"amicable settlement;Literature / Source;H.-J. Imiela, Sammlung Kohl-Weigand, 1970, Nr. 81;Read more;Read less",2010,Dr. Monika Tatzkow Wissenschaftlicher Dokumentationsdienst Phone +49 (0) 30 64 128 13 tatzkow@t-online.de,"Liebermann, Martha und Max",https://www.lostart.de/en/Verlust/417871,"H.-J. Imiela, Sammlung Kohl-Weigand, 1970, Nr. 81;Read more"
