2023,Storming of Carthago,LA456847_72307.jpg,"Unknown (Italienisch, Florenz)",1440 (um),tempera: wood (lime) / painted,,"Florentine patrician property, collection Heinrich Freiherr von Tucher (and heirs), Vienna - 08.12.1925, auction Cassirer & Helbing, Berlin 08.12.1925, lot 63, collection Veil Picard Kleinberger (?), Collection Agathe and Ernst Saulmann, Erlenhof, Württemberg/Florence - 1938/1942 (um) due to the fate of the aggrieved parties the withdrawal of the painting due to Nazi persecution cannot be excluded, the exact circumstances of the loss are unclear, art trade Paul Tulino, Paris 1941, art trade Walter Bornheim, Munich Paris 1941, Collection Dr. Friedrich Flick, - 24.12.1941 (as a gift for Hermann Göring), Collection Hermann Göring, 24.12.1941 -, Depot Berchtesgaden, No. 483, CCP Munich, 29.07.1945 - 19.10.1946, Mü-Nr. 5528, L'Office des Biens et Intérêts Privés, - 1950, Musée du Louvre, 1950 - 1969, Musée des Beaux-Arts d'Angers, 1969;18 April 2023 restitution by the French government to the heirs;Read more;Read less",,"restituted;Literature / Source;Edmund Wilhelm Braun-Troppau: Die Sammlung Tucher. In: Münchener Jahrbuch für Kunstgeschichte. (1910)II, S.178-208, hier S. 183-184, 187, D - BA, B323/319, Bd. 1: Gemälde der ""Sammlung Göring"", Bd. 1/4, Künstler S - Z sowie unbekannte Künstler, D - BA, B323/570, ""Verzeichnis der der Treuhandverwaltung bekannt gewordenen Restitutionen von 1945 bis 1962"", Bd. 1, Restitutionen nach Frankreich / 9, Aktentitel, Blatt 181, Ellen Callmann: Apollonio di Giovanni. Oxford 1974. S.87, 96 (Index), IT - Kunsthistorisches Institut, Florenz, Photothek, Konvolut Ernst Saulmann, Kunstsalon Paul Cassirer, Hugo Helbing: Die Sammlung Heinrich Freiherr von Tucher. Kunstgegenstände aus dem Nachlass seiner Exzellenz des Gesandten Heinrich Freiherrn von Tucher. Mit einem Anhang von Kunstgegenständen aus ausländischem und deutschem Privatbesitz. Auktion vom 08.12.1925. Berlin 1925. Lot 63, Tammaro de Marinis, Filippo Rossi (Hrsg.): Notice sur les miniatures ""Virgilius"" de la Bibliothèque Riccardi a Florence. In: Bulletin de la Société Française de Reproductions de Manuscrits à Peintures. 13(1930), S.17-31, hier S. 30, Raimond van Marle: The Development of the Italian Schools of Painting. New York 1970. Band X. S. 551- 554, Charlotte van Marle: The Development of the Italian Schools of Painting: Volume XIX General Index. Berlin 2013. S. 88, US - NARA, RG 239, M1944. Records of the American Commission for the Protection and Salvage of Artistic and Historic Monuments in War Areas, 1943-1946. Roll 153. Italian Private Collections Files, compiled 1943 - 1945. Blatt 16, US - NARA, RG 260, M1946. Photographs of art objects stolen by the Nazis from the Linz Museum and other collections in Europe. Roll 291. Photographs Taken by the Munich Central Collecting Point, OMGUS, of Artworks Appropriated by Germany during World War II. 260-MP-5528. Blatt 827-828, US - NARA, RG 260, M1946. Property cards from the Munich Central Collecting Point documenting the movement and disposition of each looted object. Roll 178. Records Relating to the Munich Central Collecting Point Property Accessions, 5528/Berchtesgaden 483, Paintings, Assault of Carthage. Blatt 1 und 2, US - NARA, RG 260, M1947. Textual records created at the Wiesbaden Central Collecting Point include administrative files and monthly reports. Roll 82. Restitution, Research, And Reference Records, Hofer, Walter A.: Hofer Goring Documents, Goring Lists. Blatt 38, US - NARA, RG 239, M1782. Reports by the Art Looting Investigation Unit of the OSS relating to jewels, paintings, and other art objects appropriated during WWII. Roll M1782_10F1. Consolidated Interrogation Reports (CIR) 2, The Goering Collection. S.56, Blatt 63, US - NARA, RG 260, M1947. Textual records created at the Wiesbaden Central Collecting Point include administrative files and monthly reports. Roll 81. Restitution, Research, And Reference Records. Göring: Art Museum Unterstein - Berchtesgaden, Germany. Blatt 2, 26, Mario Salmi: Paolo Uccello, Andrea del Castagno, Domenico Veneziano. Rom 1936. S. 114, www.christies.com/lotfinder/Lot/florentine-school-mid-15th-century-the-siege-of-5221710-details.aspx, www.pop.culture.gouv.fr/notice/mnr/MNR00246, ow-mba.angers.fr/ow4/mba18022013/voir.xsp?id=00101-27&qid=sdx_q0&n=7&e=;Read more;Read less",13.07.2020,von Trott zu Solz Lammek Rechtsanwälte • Notar Phone +49 (0) 30 59 00 33 0-0 kanzlei@vontrott-lammek.de,"Saulmann, Agathe und Ernst",https://www.lostart.de/en/Verlust/589707,"Edmund Wilhelm Braun-Troppau: Die Sammlung Tucher. In: Münchener Jahrbuch für Kunstgeschichte. (1910)II, S.178-208, hier S. 183-184, 187, D - BA, B323/319, Bd. 1: Gemälde der ""Sammlung Göring"", Bd. 1/4, Künstler S - Z sowie unbekannte Künstler, D - BA, B323/570, ""Verzeichnis der der Treuhandverwaltung bekannt gewordenen Restitutionen von 1945 bis 1962"", Bd. 1, Restitutionen nach Frankreich / 9, Aktentitel, Blatt 181, Ellen Callmann: Apollonio di Giovanni. Oxford 1974. S.87, 96 (Index), IT - Kunsthistorisches Institut, Florenz, Photothek, Konvolut Ernst Saulmann, Kunstsalon Paul Cassirer, Hugo Helbing: Die Sammlung Heinrich Freiherr von Tucher. Kunstgegenstände aus dem Nachlass seiner Exzellenz des Gesandten Heinrich Freiherrn von Tucher. Mit einem Anhang von Kunstgegenständen aus ausländischem und deutschem Privatbesitz. Auktion vom 08.12.1925. Berlin 1925. Lot 63, Tammaro de Marinis, Filippo Rossi (Hrsg.): Notice sur les miniatures ""Virgilius"" de la Bibliothèque Riccardi a Florence. In: Bulletin de la Société Française de Reproductions de Manuscrits à Peintures. 13(1930), S.17-31, hier S. 30, Raimond van Marle: The Development of the Italian Schools of Painting. New York 1970. Band X. S. 551- 554, Charlotte van Marle: The Development of the Italian Schools of Painting: Volume XIX General Index. Berlin 2013. S. 88, US - NARA, RG 239, M1944. Records of the American Commission for the Protection and Salvage of Artistic and Historic Monuments in War Areas, 1943-1946. Roll 153. Italian Private Collections Files, compiled 1943 - 1945. Blatt 16, US - NARA, RG 260, M1946. Photographs of art objects stolen by the Nazis from the Linz Museum and other collections in Europe. Roll 291. Photographs Taken by the Munich Central Collecting Point, OMGUS, of Artworks Appropriated by Germany during World War II. 260-MP-5528. Blatt 827-828, US - NARA, RG 260, M1946. Property cards from the Munich Central Collecting Point documenting the movement and disposition of each looted object. Roll 178. Records Relating to the Munich Central Collecting Point Property Accessions, 5528/Berchtesgaden 483, Paintings, Assault of Carthage. Blatt 1 und 2, US - NARA, RG 260, M1947. Textual records created at the Wiesbaden Central Collecting Point include administrative files and monthly reports. Roll 82. Restitution, Research, And Reference Records, Hofer, Walter A.: Hofer Goring Documents, Goring Lists. Blatt 38, US - NARA, RG 239, M1782. Reports by the Art Looting Investigation Unit of the OSS relating to jewels, paintings, and other art objects appropriated during WWII. Roll M1782_10F1. Consolidated Interrogation Reports (CIR) 2, The Goering Collection. S.56, Blatt 63, US - NARA, RG 260, M1947. Textual records created at the Wiesbaden Central Collecting Point include administrative files and monthly reports. Roll 81. Restitution, Research, And Reference Records. Göring: Art Museum Unterstein - Berchtesgaden, Germany. Blatt 2, 26, Mario Salmi: Paolo Uccello, Andrea del Castagno, Domenico Veneziano. Rom 1936. S. 114, www.christies.com/lotfinder/Lot/florentine-school-mid-15th-century-the-siege-of-5221710-details.aspx, www.pop.culture.gouv.fr/notice/mnr/MNR00246, ow-mba.angers.fr/ow4/mba18022013/voir.xsp?id=00101-27&qid=sdx_q0&n=7&e=;Read more"
2023,Madonna of Humility,LA456848_72308.jpg,"Ferrari, Defendente;Birth (um) 1490, Chivasso;Place of activity Erw.-landschaft: Piemont",1490 (um),tempera: wood / painted,55.00 cm,"Collection Heinrich Freiherr von Tucher (and heirs), Vienna - 08.12.1925, auction Cassirer & Helbing, Berlin 08.12.1925, lot 64, Collection Agathe and Ernst Saulmann, Erlenhof, Württemberg/Florence - 1928 - 1939 (um) - due to the fate of the aggrieved parties the withdrawal of the painting due to Nazi persecution cannot be excluded, the exact circumstances of the loss are unclear, art trade (?) France, art trade Walter Bornheim, Munich/Paris, O[scar R.?] Henschel, 12.01.1942 (as a gift for Göring), Art Collection Hermann Göring (G - 17), Depot Berchtesgaden, No. 2105, CCP Munich, 06.08.1945 - 25.09.1947, Mü-Nr. 7155, 25.09.1947 Restitution France, Paris, 1953 Musée de Picardie, Amiens;18 April 2023 restitution by the French government to the heirs;Read more;Read less",,"restituted;Literature / Source;Anonym: Versteigerung der Sammlung Tucher. In: Kunst und Künstler. 24(1926)5, S.199-200, hier S. 199, D - BA, B 323, 319, Bd. 1: Gemälde der ""Sammlung Göring"", Bd. 1 / 4, Künstler S - Z sowie unbekannte Künstler. Blatt 411, L. Gielly: La Donation de Holzer. In: Genava. Revue d'histoire de l'art et d'archéologie. 16(1938), S.164-168, hier S.164, 167, Tafel III, 2, IT - Kunsthistorisches Institut in Florenz (KHI) - Max Planck Institut, Photothek, Konvolut Besitz Ernst Saulmann, Kunstsalon Paul Cassirer, Hugo Helbing: Die Sammlung Heinrich Freiherr von Tucher. Kunstgegenstände aus dem Nachlass seiner Exzellenz des Gesandten Heinrich Freiherrn von Tucher. Mit einem Anhang von Kunstgegenständen aus ausländischem und deutschem Privatbesitz. Auktion vom 08.12.1925. Berlin 1925. Lot 64, Olga Pujmanová, T. Gottheinerová: Italian Primitives in Czechoslovak Collections. In: The Burlington Magazine. 119(1977)893, S.536, 538-551, hier S.546-547, Musée d'art et d'histoire, Mauro Natale: Peintures italiennes du XIVe au XVIIIe siècle. Genf 1979. S. 147, US - NARA, RG 260, M1947. Textual records created at the Wiesbaden Central Collecting Point include administrative files and monthly reports. Roll 81. Restitution, Research, And Reference Records, Göring: Art Museum Unterstein - Berchtesgaden, Germany. Blatt 7, US - NARA, RG 260, M1946. Photographs of art objects stolen by the Nazis from the Linz Museum and other collections in Europe. Roll 295. Photographs Taken by the Munich Central Collecting Point, OMGUS, of Artworks Appropriated by Germany during World War II. 260-MP-7155. Blatt 291-292, US - NARA, RG 260, M1947. Textual records created at the Wiesbaden Central Collecting Point include administrative files and monthly reports. Roll 82. Restitution, Research, And Reference Records, Hofer, Walter A.: Hofer Goring Documents, Goring Lists. Blatt 38, US - NARA, RG 260, M1946. Property cards from the Munich Central Collecting Point documenting the movement and disposition of each looted object. Roll 181. Records Relating to the Munich Central Collecting Point Property Accessions. 7155/Berchtesgaden 2105. Paintings. Madonna and Child, US - NARA, RG 239, M1944. Records of the American Commission for the Protection and Salvage of Artistic and Historic Monuments in War Areas, 1943-1946. Roll 6. Reports, 73.11c-Status Of Collecting Point MUNICH- Transport Lists FRANCE-Folder III. Blatt 7, 12, Franz Wickhoff: Die Sammlung Tucher. In: Münchener Jahrbuch der bildenden Kunst. (1908) I, S.19-30, hier S.23, 24 (Abb. 6), 25, Nancy Yeide: Beyond the dream of Avarice. The Hermann Göring Collection. Dallas 2009. S. 169, 380, catalogo.fondazionezeri.unibo.it, digitalcollections.frick.org/digico/#/details/bibRecordNumber/b14812447/Photoarchive, www.pop.culture.gouv.fr/notice/mnr/MNR00253;Read more;Read less",13.07.2020,von Trott zu Solz Lammek Rechtsanwälte • Notar Phone +49 (0) 30 59 00 33 0-0 kanzlei@vontrott-lammek.de,"Saulmann, Agathe und Ernst",https://www.lostart.de/en/Verlust/589708,"Anonym: Versteigerung der Sammlung Tucher. In: Kunst und Künstler. 24(1926)5, S.199-200, hier S. 199, D - BA, B 323, 319, Bd. 1: Gemälde der ""Sammlung Göring"", Bd. 1 / 4, Künstler S - Z sowie unbekannte Künstler. Blatt 411, L. Gielly: La Donation de Holzer. In: Genava. Revue d'histoire de l'art et d'archéologie. 16(1938), S.164-168, hier S.164, 167, Tafel III, 2, IT - Kunsthistorisches Institut in Florenz (KHI) - Max Planck Institut, Photothek, Konvolut Besitz Ernst Saulmann, Kunstsalon Paul Cassirer, Hugo Helbing: Die Sammlung Heinrich Freiherr von Tucher. Kunstgegenstände aus dem Nachlass seiner Exzellenz des Gesandten Heinrich Freiherrn von Tucher. Mit einem Anhang von Kunstgegenständen aus ausländischem und deutschem Privatbesitz. Auktion vom 08.12.1925. Berlin 1925. Lot 64, Olga Pujmanová, T. Gottheinerová: Italian Primitives in Czechoslovak Collections. In: The Burlington Magazine. 119(1977)893, S.536, 538-551, hier S.546-547, Musée d'art et d'histoire, Mauro Natale: Peintures italiennes du XIVe au XVIIIe siècle. Genf 1979. S. 147, US - NARA, RG 260, M1947. Textual records created at the Wiesbaden Central Collecting Point include administrative files and monthly reports. Roll 81. Restitution, Research, And Reference Records, Göring: Art Museum Unterstein - Berchtesgaden, Germany. Blatt 7, US - NARA, RG 260, M1946. Photographs of art objects stolen by the Nazis from the Linz Museum and other collections in Europe. Roll 295. Photographs Taken by the Munich Central Collecting Point, OMGUS, of Artworks Appropriated by Germany during World War II. 260-MP-7155. Blatt 291-292, US - NARA, RG 260, M1947. Textual records created at the Wiesbaden Central Collecting Point include administrative files and monthly reports. Roll 82. Restitution, Research, And Reference Records, Hofer, Walter A.: Hofer Goring Documents, Goring Lists. Blatt 38, US - NARA, RG 260, M1946. Property cards from the Munich Central Collecting Point documenting the movement and disposition of each looted object. Roll 181. Records Relating to the Munich Central Collecting Point Property Accessions. 7155/Berchtesgaden 2105. Paintings. Madonna and Child, US - NARA, RG 239, M1944. Records of the American Commission for the Protection and Salvage of Artistic and Historic Monuments in War Areas, 1943-1946. Roll 6. Reports, 73.11c-Status Of Collecting Point MUNICH- Transport Lists FRANCE-Folder III. Blatt 7, 12, Franz Wickhoff: Die Sammlung Tucher. In: Münchener Jahrbuch der bildenden Kunst. (1908) I, S.19-30, hier S.23, 24 (Abb. 6), 25, Nancy Yeide: Beyond the dream of Avarice. The Hermann Göring Collection. Dallas 2009. S. 169, 380, catalogo.fondazionezeri.unibo.it, digitalcollections.frick.org/digico/#/details/bibRecordNumber/b14812447/Photoarchive, www.pop.culture.gouv.fr/notice/mnr/MNR00253;Read more"
2019,Crowd of people,LA450619_66723.jpg,"Marold, Ludek;Birth 07.08.1865, Prag;Death 01.12.1898, Prag;Place of activity Paris",,Gouache / painted,30.00 cm,"collection Max and Irma Sborowitz, Prossnitz (Prostějov) / Czech Republic, 1939 (about/after) confiscation by German authorities, Proßnitz (Prostějov) / Czech Republic, 2019 amicable settlement;Read more;Read less","Prostejov (Prossnitz) / Beschlagnahme, Prostejov, 1939 (um/nach)","amicable settlement;Literature / Source;Photoalbum, Privatarchiv;Read more;Read less",30.04.2018,Rosbach & Fremy Rechtsanwälte Phone +49 (0) 30 280 70 71/72 office@ra-rff.de,"Sborowitz, Max und Irma",https://www.lostart.de/en/Verlust/576739,"Photoalbum, Privatarchiv;Read more"
,Squatting Javanese (or: Japanese?),,"Kolbe, Georg;Birth 1877.04.13, Waldheim (Sachsen);Death 1947.11.15, Berlin;Place of activity Berlin",,Bronze,,,,restituted,2001,Please contact the German Lost Art Foundation.,"Schmitz, Oscar (Nachlass)",https://www.lostart.de/en/Verlust/238624,
,Sirens,,"Rodin, Auguste;Birth 1840.11.12, Paris;Death 1917.11.17, Meudon;Place of activity Sèvres, Florenz, Brüssel, Rom, Bellevue (Sèvres)",,Bronze,,,,restituted,2001,Please contact the German Lost Art Foundation.,"Schmitz, Oscar (Nachlass)",https://www.lostart.de/en/Verlust/238626,
,Allegory of war and peace in landscape,LA16582_40813.jpg,"Brueghel, Jan (d. Ä.);Birth 1568, Brüssel;Death 1625.01.13, Antwerpen;Place of activity Brüssel, Neapel, Rom, Mailand, Antwerpen",,,50.00 cm,"Beschlagnahme Gestapo, Berlin;Read more;Read less",Berlin,amicable settlement,2006,von Trott zu Solz Lammek Rechtsanwälte Notar Phone +49 (0) 30 59 00 33 0-0 kanzlei@vontrott-lammek.de,"Schönemann, Frieda und Moritz",https://www.lostart.de/en/Verlust/319397,
2011,Still life with resting lamb at a cornfield,LA27964_44732.jpg,"Meyerheim, Paul Friedrich;Birth 1842.07.13, Berlin;Death 1915.09.14, Berlin;Place of activity Berlin",,Leinwand / painted,70.00 cm,"Versteigerung bei Leo Spik, Berlin 16./17.9. 1935, Nr. 100, Abbildung auf Tafel 6, 2011 Einigung;Read more;Read less",Berlin,restituted,2006,von Trott zu Solz Lammek Rechtsanwälte Notar Phone +49 (0) 30 59 00 33 0-0 kanzlei@vontrott-lammek.de,"Schönemann, Frieda und Moritz",https://www.lostart.de/en/Verlust/319413,
2022,Bowl with oranges,LA455227_70843.jpg,"Corinth, Lovis;Birth 1858.07.21, Tapiau (Ost-Preußen);Death 1925.07.17, Zandvoort;Place of activity Königsberg, Berlin",1922,Oil: wood / painted,40.00 cm,"Collection Curt Schueler, Berlin (until at least May 1933), [...], Dr. L. Fischel, Karlsruhe;2022 amicable settlement;Read more;Read less",,"amicable settlement;Literature / Source;Lovis Corinth, Ausstellung von Gemälden und Aquarellen zu seinem Gedächtnis, Nationalgalerie Berlin, 1926, Nr. 352 [Besitzer: Kurt Schüler, Berlin], Berend-Corinth, Charlotte, Corinth, Lovis, Röthel, Hans Konrad [Bearb.]: Die Gemälde von Lovis Corinth: Werkkatalog, München, 1958, Nr. 856 (mit Abb.);Read more;Read less",06.11.2019,Dr. Sabine Rudolph Rechtsanwältin Phone +49 (0)351 317220 rudolph@heimann-dresden.de,"Schueler, Curt",https://www.lostart.de/en/Verlust/584796,"Lovis Corinth, Ausstellung von Gemälden und Aquarellen zu seinem Gedächtnis, Nationalgalerie Berlin, 1926, Nr. 352 [Besitzer: Kurt Schüler, Berlin], Berend-Corinth, Charlotte, Corinth, Lovis, Röthel, Hans Konrad [Bearb.]: Die Gemälde von Lovis Corinth: Werkkatalog, München, 1958, Nr. 856 (mit Abb.);Read more"
2022,Dying Warrior,LA455225_70841.jpg,"Corinth, Lovis;Birth 1858.07.21, Tapiau (Ost-Preußen);Death 1925.07.17, Zandvoort;Place of activity Königsberg, Berlin",1913,Oil: canvas / painted,56.00 cm,"Prof. Frick, Collection Curt Schueler, Berlin (until at least 1933), [...];2022 amicable settlement;Read more;Read less",,"amicable settlement;Literature / Source;Lovis Corinth, Ausstellung von Gemälden und Aquarellen zu seinem Gedächtnis, Nationalgalerie Berlin, 1926, Nr. 229 [""Der Verwundete"" - Besitzer: Kurt Schüler, Berlin], Berend-Corinth, Charlotte, Corinth, Lovis, Röthel, Hans Konrad [Bearb.]: Die Gemälde von Lovis Corinth: Werkkatalog, München, 1958, Nr. 570 (mit Abb.);Read more;Read less",06.11.2019,Dr. Sabine Rudolph Rechtsanwältin Phone +49 (0)351 317220 rudolph@heimann-dresden.de,"Schueler, Curt",https://www.lostart.de/en/Verlust/584795,"Lovis Corinth, Ausstellung von Gemälden und Aquarellen zu seinem Gedächtnis, Nationalgalerie Berlin, 1926, Nr. 229 [""Der Verwundete"" - Besitzer: Kurt Schüler, Berlin], Berend-Corinth, Charlotte, Corinth, Lovis, Röthel, Hans Konrad [Bearb.]: Die Gemälde von Lovis Corinth: Werkkatalog, München, 1958, Nr. 570 (mit Abb.);Read more"
,Asters/ Reines-marguerites,,"Fantin-Latour, (Theodore) Title Asters/ Reines-marguerites Datierung 1869 Object type Painting Group of reported objects Painting Material / Technique canvas / painted;Height 57.00 cm;Width 49.00 cm;Description;Margerite flowers in a vase. Their flowers are focused on the surrounding fruits lying on a tablecloth. Plums, peaches and grapes.;Read more;Read less;Provenance;Richard Semmel, Berlin, offered on auction Muller, Amsterdam, 13.06.1933, no 12, with illustration;settlement between claimants and current owner;Read more;Read less;Verlustgeschichte Amsterdam / Auktion Muller, 1933;Status;amicable settlement;Published since 22.11.2017",1869,canvas / painted,57.00 cm,"Richard Semmel, Berlin, offered on auction Muller, Amsterdam, 13.06.1933, no 12, with illustration;settlement between claimants and current owner;Read more;Read less","Amsterdam / Auktion Muller, 1933",amicable settlement,22.11.2017,Olaf S. Ossmann Rechtsanwalt office@ossmann.ch,"Semmel, Richard",https://www.lostart.de/en/Verlust/572219,
2022,Snow in Argenteuil/ Neige à Argenteuil,LA446390_63685.jpg,"Monet, Claude Oscar;Birth 1840.02.14, Paris;Death 1926.12.16, Giverny (Eure);Place of activity Le Havre, Paris, Paris-Argenteuil, Vétheuil, Giverny (Eure)",1875,canvas / painted,60.50 cm,"Richard Semmel, Berlin, offered on auction Muller, Amsterdam, 13.06.1933, no. 21, with fig.;2022 amicable settlement with the heirs;Read more;Read less","Amsterdam / Auktion Muller, 1933",amicable settlement,22.11.2017,Olaf S. Ossmann Rechtsanwalt office@ossmann.ch,"Semmel, Richard",https://www.lostart.de/en/Verlust/572251,
,The bouquet of flowers/ Le bouquet de fleurs (Bouquet of lilacs / Bouquet of Lilacs),,"Pissarro, Camille Jacob;Birth 1831.07.10, St. Thomas (West-Indien);Death 1903.11.13, Paris;Place of activity Paris, Montmorency, La Varenne-St.Hilaire, Pontoise, London, Eragny",1876,canvas / painted,71.00 cm,"Paul Emil Pissarro (son of Camille Pissarro), acquired by Semmel, Berlin by Galerie Heinemann on 28.08.1929 for 15.000 RM, Richard Semmel, Berlin, issued Exposition du Centenaire de la Nancy de Camille Pissarro, au Musée de l'Orangerie des Tuileries, Paris 1930, no. 138 (owner: Richard Semmel, Berlin), offered on auction Muller, Amsterdam, 13.06.1933, no. 25, with fig. For 1.000 fl offered, back, Gallery Moos, Geneva, of Moos, 17.11.1945, acquired by Knoedler, New York, October-November 1945 Exhibition Gallery Wildenstein, New York ""Camille Pissarro: His Place in Art"", No. 14, January 2, 1946 by Knoedler to Richard N. Ryan, New York, Mrs Clifford Klenk (formerly Mrs. Ryan), New York, 1961 Exhibition New York, Metropolitan Museum, ""Paintings from Private Collections"", No. 70, 1962 Exhibition New York, Metropolitan Museum, ""Paintings from Private Collections"", No. 69, 1963 Exhibition New York, Metropolitan Museum, ""Paintings from Private Collections"", No. 58, 1966 Exhibition New York, Knoedler Galleries ""Impressionist Treasures from Private Collections in New York"", No. 23, 09.10.1968 Auction Parke-Bernet, New York (The property of a New York private collector (Mrs. Clifford Klenk)), No. 3 with Fig., here purchased by the Norton Simon Museum of Art, Pasadena (Calif.), 1969 Exhibition Philadelphia Museum of Art ""Recent Acquisitions by the Norton Simon, Inc. Museum of Art"", No. 9, 1970 Exhibition Berkeley, University Art Museum ""Excellence: Art from the University Community"", No. 288, 02.-04.05.1973, New York auction, Sotheby Parke-Bernet (Property of Norton Simon Museum of Art), No. 24, purchased here by Marlborough International Fine Art, Vaduz, Dec. 1973 Exhibition Princeton (New Jersey), The Art Museum ""Selections from the Norton Simon Museum of Arts"" No. 26, by Marlborough International Fine Art, Vaduz 1974 to a private collector from Madrid sold, 02.05.2006 Auction Christie's New York, Lot. 3, cat. P. 13, estimated price US $ 800,000-1,200,000 - not sold, amicable agreement under negotiation;settlement between claimants and current owner;Read more;Read less","Amsterdam / Auktion Muller, 1933",amicable settlement,22.11.2017,Olaf S. Ossmann Rechtsanwalt office@ossmann.ch,"Semmel, Richard",https://www.lostart.de/en/Verlust/572264,
2019,Eleven red apples (Still life with peaches)/ Les onze pommes rouges;Nature morte aux pêches,LA446406_63701.jpg,"Renoir, Auguste;Birth 1841.02.25, Limoges;Death 1919.12.02, Cagnes;Place of activity Paris, Essoyes",1902-1904,canvas / painted,19.50 cm,"29 June 1926 Auction Bangel Frankfurt, Richard Semmel, Berlin, offered on auction Muller, Amsterdam, 13.06.1933, no. 38, with fig., Georges Darier, Geneva, offered at auction Galerie Moos, Geneva, 23.05.1936, no. 27, 11 December 1948 Parke Bernet Galleries (C.S. Wadsworth Trust) New York, cat. No. 76 $ 1,800, 21 May 1982 Sotheby's Parke Bernet, No. 309A, 16 November 1988 Christie's New York, Lot 270;2019 amicable settlement with the heirs;Read more;Read less","Amsterdam / Auktion Muller, 1933",amicable settlement,22.11.2017,Olaf S. Ossmann Rechtsanwalt office@ossmann.ch,"Semmel, Richard",https://www.lostart.de/en/Verlust/572281,
2022,Fruit seller in a gateway (market scene / cheese seller)/ La marchande de fromage,LA446420_63715.jpg,"Zick, Januarius;Birth 1730.02.06 / 1732.05.31?, München;Death 1797.11.14, Ehrenbreitstein;Place of activity Basel, Rom, Augsburg, Trier, Wiblingen",,canvas / painted,69.00 cm,"Richard Semmel, Berlin, 1925 exhibited at the Berlin exhibition ""Gemälde Alter Meister aus Berliner Privatbesitz"", catalog p. 66, no. 435, owner: R.S., offered at the auction Muller, Amsterdam 21.11.1933, no. 69 (here without fig.), offered at auction Galerie Moos, Geneva, 23.05.1936, no. 146, 09.06.1978 at Christie's in London (auction Mrs. H.W. Cohu e.a., cat. No. 202 or 201, with fig.), here acquired by Scheidwimmer (?), Nov. 1978 at the Munich Trade Fair, art dealer Xaver Scheidwimmer (pre-announcement with Fig. In Burlington July 1978, p. 788);2022 restituted to the heirs;Read more;Read less","Amsterdam / Auktion Muller, 1933",restituted,22.11.2017,Olaf S. Ossmann Rechtsanwalt office@ossmann.ch,"Semmel, Richard",https://www.lostart.de/en/Verlust/572299,
