2021,Der heilige Florian,LA21692_42480.jpg,Meister der Darmstädter Passion;Place of activity Mittelrhein First mentioned 1201/1300,,oil: wood / painted,123.00 cm,"Auctioned by Paul Graupe, Berlin, on 17/18.06.1936 under no. 31;2021 restitution to the heirs;Read more;Read less","Berlin / Auktion Paul Graupe, 17.06 /18.06.1936",restituted,2008,von Trott zu Solz Lammek Rechtsanwälte • Notar Phone +49 (0) 30 59 00 33 0-0 kanzlei@vontrott-lammek.de,"Drey, A. S., Kunsthaus",https://www.lostart.de/en/Verlust/406275,
2023,Large bouquet,,Unknown (Dutch (Monogram J. A. A.)),1638,Oil;Canvas / painted,60.00 cm,"Collection Margarete Eisenmann, Berlin, Auction Lepke, Berlin 19-20.06.1935, Lot 78, whereabouts unknown, [...], auction Phillips, London, lot 64, 02.12.1997, Galerie Neuse, Bremen, 1999, private collection;2023 amicable settlement;Read more;Read less",,"amicable settlement;Literature / Source;Rudolph Lepke's Kunst-Auctions-Haus: Kunstsammlung und Wohnungseinrichtung Generalkonsul Eisenmann, Berlin: 19. und 20. Juni 1935. Berlin 1935. Kat. Nr. 78;Read more;Read less",19.08.2022,von Trott zu Solz Lammek Rechtsanwälte Notar Phone +49 (0) 30 59 00 33 0-0 kanzlei@vontrott-lammek.de,"Eisenmann, Margarete (geb. Ledermann)",https://www.lostart.de/en/Verlust/601384,"Rudolph Lepke's Kunst-Auctions-Haus: Kunstsammlung und Wohnungseinrichtung Generalkonsul Eisenmann, Berlin: 19. und 20. Juni 1935. Berlin 1935. Kat. Nr. 78;Read more"
,Flora,LA415167_45204.jpg,"Waldmüller, Ferdinand Georg;Birth 1793.01.15, Wien;Death 1865.08.23, Helmstreitmühle (Baden);Place of activity Preßburg, Agram, Wien",1826,Oil: panel / painted,250.00 cm,"Collection Dr. Eissler, Vienna, June 1938 as a part of four panels purchased by the art dealer Maria Almas-Dietrich, Munich, for the so called Linz collection, whereabout: Austria;Read more;Read less",Juni 1938,restituted,2010,Rowland & Petroff Attorneys at Law Phone +1 212-685-5509 info@rowlandlaw.com,"Eissler, Dr. Hermann und Hortense (Berta Morelli)",https://www.lostart.de/en/Verlust/417721,
,Galenus (Male figure),LA415213_45225.jpg,"Waldmüller, Ferdinand Georg;Birth 1793.01.15, Wien;Death 1865.08.23, Helmstreitmühle (Baden);Place of activity Preßburg, Agram, Wien",1808/1826,Oil: wood / painted,250.00 cm,"Collection Dr. Eissler, Vienna, June 1938 as a part of four panels purchased by the art dealer Maria Almas-Dietrich, Munich, for the so called Linz collection, whereabout: Austria;Read more;Read less",Juni 1938,restituted,2010,Rowland & Petroff Attorneys at Law Phone +1 212-685-5509 info@rowlandlaw.com,"Eissler, Dr. Hermann und Hortense (Berta Morelli)",https://www.lostart.de/en/Verlust/417775,
,Hippokrates (Male figure),LA415214_45226.jpg,"Waldmüller, Ferdinand Georg;Birth 1793.01.15, Wien;Death 1865.08.23, Helmstreitmühle (Baden);Place of activity Preßburg, Agram, Wien",1808/1826,Oil: wood / painted,250.00 cm,"Collection Dr. Eissler, Vienna, June 1938 as a part of four panels purchased by the art dealer Maria Almas-Dietrich, Munich, for the so called Linz collection, whereabout: Austria;Read more;Read less",Juni 1938,restituted,2010,Rowland & Petroff Attorneys at Law Phone +1 212-685-5509 info@rowlandlaw.com,"Eissler, Dr. Hermann und Hortense (Berta Morelli)",https://www.lostart.de/en/Verlust/417776,
,Hygieia (Female figure),LA415215_45227.jpg,"Waldmüller, Ferdinand Georg;Birth 1793.01.15, Wien;Death 1865.08.23, Helmstreitmühle (Baden);Place of activity Preßburg, Agram, Wien",1808/1826,Oil: wood / painted,250.00 cm,"Collection Dr. Eissler, Vienna, June 1938 as a part of four panels purchased by the art dealer Maria Almas-Dietrich, Munich, for the so called Linz collection, whereabout: Austria;Read more;Read less",Juni 1938,restituted,2010,Rowland & Petroff Attorneys at Law Phone +1 212-685-5509 info@rowlandlaw.com,"Eissler, Dr. Hermann und Hortense (Berta Morelli)",https://www.lostart.de/en/Verlust/417777,
2020,Altaussee with Dachstein mountain,LA415163_45200.jpg,"Waldmüller, Ferdinand Georg;Birth 1793.01.15, Wien;Death 1865.08.23, Helmstreitmühle (Baden);Place of activity Preßburg, Agram, Wien",1834,Oil: panel / painted,31.00 cm,"Collection Dr. Eissler, Wien, Mai 1939 purchased by the art dealer Maria Almas-Dietrich for the Reichskanzlei and Hitler’s so called Linz collection, State property of Germany, as a loan in the Staatlichen Kunsthalle Karlsruhe;2020 Restitution to the heirs;Read more;Read less",1939,restituted,2010,Rowland & Petroff Attorneys at Law Phone +1 212-685-5509 info@rowlandlaw.com,"Eissler, Dr. Hermann und Hortense (Berta Morelli)",https://www.lostart.de/en/Verlust/417717,
2020,Torrent near by Ischl (Upper Austria),LA415164_45201.jpg,"Waldmüller, Ferdinand Georg;Birth 1793.01.15, Wien;Death 1865.08.23, Helmstreitmühle (Baden);Place of activity Preßburg, Agram, Wien",1831,Oil: panel / painted,31.00 cm,"Collection Dr. Eissler, Wien, Mai 1939 purchased by the art dealer Maria Almas-Dietrich for the Reichskanzlei and Hitler’s so called Linz collection, State property of Germany, as a loan in the Neue Pinakothek München;2020 Restitution to the heirs;Read more;Read less",1939,restituted,2010,Rowland & Petroff Attorneys at Law Phone +1 212-685-5509 info@rowlandlaw.com,"Eissler, Dr. Hermann und Hortense (Berta Morelli)",https://www.lostart.de/en/Verlust/417718,
2020,Three bronze statuettes,LA423176_51489.jpg,Unknown (Italienisch),1601/1700,Bronze,,"Feist Collection, Seizure Caesar Wollheim, Berlin, Auction Hans W. Lange 1939, Caesar Wollheim, Berlin, Lange auction 1940, [...], 2020 amicable settlement with the heirs;Read more;Read less",,amicable settlement,24.09.2012,Rosbach & Fremy Rechtsanwälte Phone +49 (0) 30 280 70 71/72 office@ra-rff.de,"Feist-Wollheim, Hans und Ernst (Erbengemeinschaft)",https://www.lostart.de/en/Verlust/459606,
2019,Two hexagonal vases,,Unknown (Deutsch (Meißen)),1701/1800,porcelain & bronze / painted,,"Feist Collection, [Schlossmuseum, Berlin, Auction Julius Böhler 1937]?, [...], 2019 amicable agreement;Read more;Read less",,"amicable settlement;Literature / Source;Rudolf Simonis: Inventory of the Art Collection of Hermine Feist-Wollheim, undated. In: Leo Baeck Institute, New York. AR 7019 / MF 551. Series XIV: Varia, undated, 1700s-1922. Box 9 Folder 10. Großes Esszimmer, Vitrine, Nummer 491;Read more;Read less",31.08.2011,Rosbach & Fremy Rechtsanwälte Phone +49 (0) 30 280 70 71/72 office@ra-rff.de,"Feist-Wollheim, Hans und Ernst (Erbengemeinschaft)",https://www.lostart.de/en/Verlust/439801,"Rudolf Simonis: Inventory of the Art Collection of Hermine Feist-Wollheim, undated. In: Leo Baeck Institute, New York. AR 7019 / MF 551. Series XIV: Varia, undated, 1700s-1922. Box 9 Folder 10. Großes Esszimmer, Vitrine, Nummer 491;Read more"
2019,Ein Paar Vasen,LA419922_48895.jpg,Unknown (Deutsch (Meißen)),1735 (um),porcelain & bronze / painted,27.50 cm,"Feist Collection, [Schlossmuseum, Berlin, Auction Julius Böhler 1937], 2019 Agreement between Feist heirs and the current owner (amicable settlement);Read more;Read less",,amicable settlement,31.08.2011,Rosbach & Fremy Rechtsanwälte Phone +49 (0) 30 280 70 71/72 office@ra-rff.de,"Feist-Wollheim, Hans und Ernst (Erbengemeinschaft)",https://www.lostart.de/en/Verlust/439800,
2021,Paar Poutpourri- Deckelvasen,LA419813_48789.jpg,Unknown (Deutsch (Höchst)),1755 (um),porcelain / painted,13.50 cm,"collection Feist;collection Rohde;The Distinguished Collection of a Lady, Auktion Sotheby's 1997;2021 Restitution to the heirs;Read more;Read less",,restituted,31.08.2011,Rosbach & Fremy Rechtsanwälte Phone +49 (0) 30 280 70 71/72 office@ra-rff.de,"Feist-Wollheim, Hans und Ernst (Erbengemeinschaft)",https://www.lostart.de/en/Verlust/439317,
2021,Paar Poutpourri- Deckelvasen,LA419813_48789.jpg,Unknown (Deutsch (Höchst)),1755 (um),porcelain / painted,13.50 cm,"collection Feist;collection Rohde;The Distinguished Collection of a Lady, Auktion Sotheby's 1997;2021 Restitution to the heirs;Read more;Read less",,restituted,31.08.2011,Rosbach & Fremy Rechtsanwälte Phone +49 (0) 30 280 70 71/72 office@ra-rff.de,"Feist-Wollheim, Hans und Ernst (Erbengemeinschaft)",https://www.lostart.de/en/Verlust/439317,
,Sedulitas (Diligence),LA438864_54590.jpg,"Passe, Crispyn de (1);Birth 1564, Arnemuiden;Death (vor) 1637.03.06, Utrecht;Place of activity Antwerpen, Aachen, Köln, Utrecht",,"Pen, bister on chalk-grounded paper / drawn",18.40 cm,Collection Dr. Arthur Feldmann;Read more;Read less,,"amicable settlement;Literature / Source;K. Boon & J. Verbeek, Dutch and Flemish Etchings, Engravings and Woodcutes ca. 1450-1700, vol. XV, p. 180, Nr. 7;Read more;Read less",08.05.2014,Please contact the German Lost Art Foundation.,"Feldmann, Dr. Arthur",https://www.lostart.de/en/Verlust/518781,"K. Boon & J. Verbeek, Dutch and Flemish Etchings, Engravings and Woodcutes ca. 1450-1700, vol. XV, p. 180, Nr. 7;Read more"
,"Mountain landscape, in the foreground near a wooden bridge are two men, old trees",,"Ryckaert, Marten;Birth 1587.12.08 (vor), Antwerpen;Death 1631.10.11 (vor), Antwerpen",,Brush in blue ink / drawn,11.00 cm,"Formerly in the collections of Petzold, R. Peltzer (sold at H.G. Gutekunst on May 13/14, 1914 (lot 360)) and Dr. F. Pokorny.;Sold at Sotheby’s London on October 16, 1946 (lot 45a) to Wheeler, restitution;Read more;Read less",,restituted,08.05.2014,Please contact the German Lost Art Foundation.,"Feldmann, Dr. Arthur",https://www.lostart.de/en/Verlust/518802,
2021,2 drawings on double-sided sheet: Study for holy knight Giorgio or Nazaro (recto);Study for holy deacon with big book (verso),LA438982_54713.jpg,"Cavedone, Giacomo;Birth 1577.04.14 (vor), Sassuolo;Death 1660, Bologna;Place of activity Sassuolo, Bologna, Modena",,"Black chalk and charcoal, heightened with white on toned paper / drawn",31.30 cm,"collection Dr. Arthur Feldmann, sold at Sotheby's London on March 23, 1971 (Lot 57) to Pietro Scarpa;2021 restitution to the heirs;Read more;Read less",,restituted,08.05.2014,Please contact the German Lost Art Foundation.,"Feldmann, Dr. Arthur",https://www.lostart.de/en/Verlust/518716,
,Landscape with a castle and figures,LA438855_54581.jpg,"Grave, Josua de Title Landscape with a castle and figures Datierung 1674 Object type Drawing Group of reported objects Graphic Material / Technique Pen, brown ink and gray wash / drawn;Height 10.10 cm;Width 15.70 cm;Description;signed ""Josua de Grave inventor"", dated on verso 1674;Read more;Read less;Provenance;Collection Dr. Arthur Feldmann, formerly in the collection of Pitcairn Knowles Sold at Sotheby’s London on October 16, 1946 (lot 62) to Stenman and later in the collection of Sold at Sotheby’s London on October 16, 1946 (lot 62) to Stenman and later in the collection of 108). In the collection of F.C. Butôt, St. Gilgen, Switzerland from 1981-1993 (sold at Sotheby's Amsterdam on November 16, 1993 (lot 113));restituted from the Kunstmuseum St. Gallen, Switzerland;Read more;Read less;Status;restituted;Literature / Source;Literatur/Literatre: Laurens J. Bol, Netherlandish Paintings and Drawings from the Collection of F.C. Butôt by little-known and rare masters of the seventeenth century, Nr. 46;Ausstellungen/Exhibits: Stockholm National Museum, Dutch and Flemish Drawings (1953);Read more;Read less;Published since 08.05.2014;Contact;Please contact the German Lost Art Foundation.",1674,"Pen, brown ink and gray wash / drawn",10.10 cm,"Collection Dr. Arthur Feldmann, formerly in the collection of Pitcairn Knowles Sold at Sotheby’s London on October 16, 1946 (lot 62) to Stenman and later in the collection of Sold at Sotheby’s London on October 16, 1946 (lot 62) to Stenman and later in the collection of 108). In the collection of F.C. Butôt, St. Gilgen, Switzerland from 1981-1993 (sold at Sotheby's Amsterdam on November 16, 1993 (lot 113));restituted from the Kunstmuseum St. Gallen, Switzerland;Read more;Read less",,"restituted;Literature / Source;Literatur/Literatre: Laurens J. Bol, Netherlandish Paintings and Drawings from the Collection of F.C. Butôt by little-known and rare masters of the seventeenth century, Nr. 46;Ausstellungen/Exhibits: Stockholm National Museum, Dutch and Flemish Drawings (1953);Read more;Read less",08.05.2014,Please contact the German Lost Art Foundation.,"Feldmann, Dr. Arthur",https://www.lostart.de/en/Verlust/518747,"Literatur/Literatre: Laurens J. Bol, Netherlandish Paintings and Drawings from the Collection of F.C. Butôt by little-known and rare masters of the seventeenth century, Nr. 46;Ausstellungen/Exhibits: Stockholm National Museum, Dutch and Flemish Drawings (1953);Read more"
2015,"Horsemen entering the city of Antwerp (in the distance the spires of St. Michael, St. Paul and St. James)",LA438978_54709.jpg,"Neyts, Gillis;Birth (vor) 1623.04.04, Gent?;Death 1687, Antwerpen",,"Pen, ink / drawn",21.10 cm,"Formerly in the collection of Prince Wladimir Nikolaevitch Argoutinsky-Dolgorucky (L. 2602d);Sold at Sotheby’s London on October 16, 1946 (lot 49) to Lionel Abel Smith, Sotheby’s London, March 23, 1970 (lot 8), Sotheby’s Mak van Waay, Amsterdam, November 6, 1978 (lot 291) Currently in the Royal National Library, Brussels;2015 restituted, Belgium Royal National Library;Read more;Read less",,restituted,08.05.2014,Please contact the German Lost Art Foundation.,"Feldmann, Dr. Arthur",https://www.lostart.de/en/Verlust/518776,
2020,Autostrasse im Taunus| Taunus Road,,"Kirchner, Ernst Ludwig;Birth 1880.05.06, Aschaffenburg;Death 1938.06.15, Frauenkirch (Davos);Place of activity *",1916,oil: canvas / painted,71.00 cm,"Until 1926 Rosi Fischer, Frankfurt, 1926 to 1935/1938 Max Fischer, Berlin, 1931 temporarily on commission at the Ferdinand Möller Galerie, Berlin, 1938 to 1945 Kurt Feldhäuser, Berlin, 1945 to 1951 Marie-Luise Feldhäuser, Berlin/ New York, 1951 Weyhe Gallery, New York, Since 1951 private collection, Ohio USA, May 9, 2002 auction Impressionist Art, Part II, Sotheby's N.Y. lot 203, Private collection, October 7, 2010 - January 16, 2011 on loan to the exhibition ""Kirchner"", Kunsthalle Hamburg;Amicable settlement in 2020;Read more;Read less",,"amicable settlement;Literature / Source;Quelle | Source: Galerie Ferdinand Möller, Aufstellung der von Herrn Dr. Fischer in Kommission erhaltenen Arbeiten, 11. November 1931, Nr. 34;Donald Gordon-Archiv, Oil Paintings by Ernst Ludwig Kirchner formerly in the Kurt Feldhäusser Collection, Berlin, no. 4.;Literatur | Literature: Donald Edward Gordon: Ernst Ludwig, Kirchner, Katalog sämtlicher Gemälde, 1968, Nr. 451.;Ausstellung | Exhibition: Kirchner [Ausstellung, Hubertus-Wald-Forum in der Hamburger Kunsthalle 2010/2011], Nr. 151, (Abb. S. 138).;Read more;Read less",21.08.2020,Rowland & Petroff Attorneys at Law Phone +1 212-685-5509 info@rowlandlaw.com,"Fischer, Max",https://www.lostart.de/en/Verlust/590978,"Quelle | Source: Galerie Ferdinand Möller, Aufstellung der von Herrn Dr. Fischer in Kommission erhaltenen Arbeiten, 11. November 1931, Nr. 34;Donald Gordon-Archiv, Oil Paintings by Ernst Ludwig Kirchner formerly in the Kurt Feldhäusser Collection, Berlin, no. 4.;Literatur | Literature: Donald Edward Gordon: Ernst Ludwig, Kirchner, Katalog sämtlicher Gemälde, 1968, Nr. 451.;Ausstellung | Exhibition: Kirchner [Ausstellung, Hubertus-Wald-Forum in der Hamburger Kunsthalle 2010/2011], Nr. 151, (Abb. S. 138).;Read more"
2018,Spanierin,LA27979_44747.jpg,"Zuloaga, Ignacio;Birth 1870.07.26, Eibar;Death 1945.10.31, Madrid;Place of activity Eibar (Guipúzcoa), Madrid, Segovia, Sevilla, Paris, Zumaya (Guipúzcoa), Rom",,painted,,"Frankfurt/Main file of proceedings Städel letter to WGK Frankfurt 1955, illustration by heirs available, 2018 amicable agreement reached, the property is no longer regarded as wanted or missing;Read more;Read less","Frankfurt (Main), 1937",amicable settlement,2005,Von Trott zu Solz - Lammek Rechtsanwälte - Notar Phone +49 (0) 30 59 00 33 00 kanzlei@vontrott-lammek.de,"Flersheim, Ernst und Gertrud",https://www.lostart.de/en/Verlust/309729,
2020,Dawdler Benak leafing through a large Tome,LA415556_45474.jpg,"Burger, Anton;Birth 1824.11.14, Frankfurt (Main);Death 1905.07.06, Kronberg (Taunus)",1887,Oil: canvas / painted,29.00 cm,"Helbing, Frankfurt 11-13 May 1937, no. 17 not sold at auction, see letter Kauffmann, Inh. v. Helbing, returned to Flersheim (warehouse) subsequently confiscated by the Gestapo, auction at Hahn, Frankfurt/Main on 5 April 1938, no. 15, ill. plate 6;2020 amicable settlement with the heirs;Read more;Read less","Frankfurt (Main), 1937",amicable settlement,2005,Von Trott zu Solz - Lammek Rechtsanwälte - Notar Phone +49 (0) 30 59 00 33 00 kanzlei@vontrott-lammek.de,"Flersheim, Ernst und Gertrud",https://www.lostart.de/en/Verlust/309704,
,Birch Trees at a Brook near Worpswede,LA28300_45001.jpg,"Modersohn, Otto;Birth 1865.02.22, Soest (Westfalen);Death 1943.03.10, Rotenburg (Hannover)",1894,Oil: Canvas / painted,98.00 cm,"Ausstellung der ""Münchner Sezession"" 1895, Helbing, Frankfurt 11.-13.Mai 1937, Nr. 50, Käufer: J.P.Schneider, Kunsthändler, Frankfurt/Main, Bolland & Marotz, Bremen, 27. März 1999, Lot 502, mit Abb., Galerie French & Company LLC, New York, NY, von dort auf der TEFAF 2000, dort verkauft.;Read more;Read less","Frankfurt (Main), 1937",amicable settlement,2005,Von Trott zu Solz - Lammek Rechtsanwälte - Notar Phone +49 (0) 30 59 00 33 00 kanzlei@vontrott-lammek.de,"Flersheim, Ernst und Gertrud",https://www.lostart.de/en/Verlust/309712,
2010,Holzfuhrwerk im Schnee,LA27970_44738.jpg,"Zügel, Heinrich von;Birth 1850.10.22, Murrhardt;Death 1941.01.30, München;Place of activity Stuttgart, München",1895,,,"Helbing, Frankfurt 11.-13.Mai 1937, Nr. 95, Privatbesitz, 2010 restituiert;Read more;Read less","Frankfurt (Main), 1937",restituted,2005,Von Trott zu Solz - Lammek Rechtsanwälte - Notar Phone +49 (0) 30 59 00 33 00 kanzlei@vontrott-lammek.de,"Flersheim, Ernst und Gertrud",https://www.lostart.de/en/Verlust/309727,
2020,Procession in the Mountains,,"Hölzel, Adolf;Birth 1853.05.13, Olmütz;Death 1934.10.17, Stuttgart",1913,Oil & Canvas,60.00 cm,"Helbing, Frankfurt 11-13 May 1937, No. 32;2020 restitution to the heirs;Read more;Read less","Frankfurt (Main), 1937",restituted,2005,Von Trott zu Solz - Lammek Rechtsanwälte - Notar Phone +49 (0) 30 59 00 33 00 kanzlei@vontrott-lammek.de,"Flersheim, Ernst und Gertrud",https://www.lostart.de/en/Verlust/309711,
2018,Pferdeschwemme,LA416014_45838.jpg,"Daumier, Honoré;Birth 1808.02.26 / 1810.26.02, Marseille;Death 1879.02.10, Valmondois;Place of activity Paris, Valmondois",,Oil: canvas / painted,42.50 cm,"Collection Martin und Florence Flersheim, 1944 confiscated in Amsterdam, 1968 collection J. Kramer, Buenos Aires, 13.05.1999 purchased by Christie's NY, Lot. 113, 2018 friendly agreement;Read more;Read less","Amsterdam / Beschlagnahme, 1944",amicable settlement,2010,von Trott zu Solz Lammek Rechtsanwälte Notar Phone +49 (0) 30 59 00 33 0-0 kanzlei@vontrott-lammek.de,"Flersheim, Martin und Florence",https://www.lostart.de/en/Verlust/422581,
2019,Eppstein,LA455678_71138.jpg,"Becker, Peter;Birth 1828.11.10, Frankfurt (Main);Death 1904.08.18, Soest (Westfalen);Place of activity Oberwesel, Altweilnau, Eppstein (Taunus)",,drawn,52.00 cm,"Collection Martin and Florence Flersheim, 1944 confiscated in Amsterdam, end of 2019 amicable settlement;Read more;Read less","Amsterdam / Beschlagnahme, 1944",amicable settlement,2010,von Trott zu Solz Lammek Rechtsanwälte Notar Phone +49 (0) 30 59 00 33 0-0 kanzlei@vontrott-lammek.de,"Flersheim, Martin und Florence",https://www.lostart.de/en/Verlust/421990,
,The Good Samaritan,,"Steinhausen, Wilhelm August Theodor;Birth 1846.02.02, Sorau (Nieder-Lausitz);Death 1924.01.05, Frankfurt (Main);Place of activity Berlin, Karlsruhe, München, (Burg) Schöneck (Hunsrück)",1890,Oil: cardboard / painted,42.00 cm,"1906 purchase from the artist, collection Martin and Florence Flersheim, 1938 confiscated in Frankfurt;Read more;Read less","Frankfurt (Main) / Beschlagnahme, 1938",restituted,2010,von Trott zu Solz Lammek Rechtsanwälte Notar Phone +49 (0) 30 59 00 33 0-0 kanzlei@vontrott-lammek.de,"Flersheim, Martin und Florence",https://www.lostart.de/en/Verlust/422119,
,The Good Samaritan,LA416004_45830.jpg,"Steinhausen, Wilhelm August Theodor;Birth 1846.02.02, Sorau (Nieder-Lausitz);Death 1924.01.05, Frankfurt (Main);Place of activity Berlin, Karlsruhe, München, (Burg) Schöneck (Hunsrück)",1890,Oil: cardboard / painted,42.00 cm,"1906 purchase from the artist, collection Martin and Florence Flersheim, 1938 confiscated in Frankfurt;Read more;Read less","Frankfurt (Main) / Beschlagnahme, 1938",restituted,2010,von Trott zu Solz Lammek Rechtsanwälte Notar Phone +49 (0) 30 59 00 33 0-0 kanzlei@vontrott-lammek.de,"Flersheim, Martin und Florence",https://www.lostart.de/en/Verlust/422120,
,The Good Samaritan,,"Steinhausen, Wilhelm August Theodor;Birth 1846.02.02, Sorau (Nieder-Lausitz);Death 1924.01.05, Frankfurt (Main);Place of activity Berlin, Karlsruhe, München, (Burg) Schöneck (Hunsrück)",1890,Oil: cardboard / painted,42.00 cm,"1906 purchase from the artist, collection Martin and Florence Flersheim, 1938 confiscated in Frankfurt;Read more;Read less","Frankfurt (Main) / Beschlagnahme, 1938",restituted,2010,von Trott zu Solz Lammek Rechtsanwälte Notar Phone +49 (0) 30 59 00 33 0-0 kanzlei@vontrott-lammek.de,"Flersheim, Martin und Florence",https://www.lostart.de/en/Verlust/422121,
2022,Concert,,"Liebermann, Max;Birth 1847.07.20, Berlin;Death 1935.02.08, Berlin;Place of activity Berlin",,Watercolour (pencil sketch): white paper / drawn (watercolour),23.00 cm,"Clara and Julius Freund, Berlin, 21.03.1942 Auction at Galerie Fischer, Lucerne, No. 215;2022 amicable settlement;Read more;Read less","Luzern / Auktion, 1942",amicable settlement,08.02.2019,von Trott zu Solz Lammek Rechtsanwälte Notar Phone +49 (0) 30 59 00 33 0-0 kanzlei@vontrott-lammek.de,"Freund, Julius und Clara",https://www.lostart.de/en/Verlust/582399,
2022,Prenuptial agreement,,"Chodowiecki, Daniel Nicolaus;Birth 1726.10.16, Danzig;Death 1801.02.07, Berlin;Place of activity Berlin",,Pen wash: white paper / drawn,8.50 cm,"Clara and Julius Freund, Berlin, 21.03.1942 Auction at the Galerie Fischer Luzern, No. 69, Dr. M. (?);2022 amicable settlement with the heirs;Read more;Read less","Luzern / Auktion, 1942",amicable settlement,08.02.2019,von Trott zu Solz Lammek Rechtsanwälte Notar Phone +49 (0) 30 59 00 33 0-0 kanzlei@vontrott-lammek.de,"Freund, Julius und Clara",https://www.lostart.de/en/Verlust/582321,
,Lady with mandolin,,"Blechen, Karl;Birth 1798.07.29, Cottbus;Death 1840.07.23, Berlin;Place of activity Berlin",1834,white paper / drawn (watercolour),19.50 cm,"Clara and Julius Freund, Berlin, 21.03.1942 Auction at Galerie Fischer, Lucerne, No. 42, National Gallery of Canada;amicable settlement with the heirs;Read more;Read less","Luzern / Auktion, 1942",amicable settlement,08.02.2019,von Trott zu Solz Lammek Rechtsanwälte Notar Phone +49 (0) 30 59 00 33 0-0 kanzlei@vontrott-lammek.de,"Freund, Julius und Clara",https://www.lostart.de/en/Verlust/582287,
2023,Landscape near Ferch,,"Hagemeister, Karl;Birth 1848.03.12, Werder (Havel);Death 1933.08.06, Werder (Havel)",,Oil: canvas / painted,49.00 cm,"Clara and Julius Freund, Berlin, 21.03.1942 Auction at Galerie Fischer, Lucerne, No. 111, unsold, 25-29.05.1943 auction at Galerie Fischer, Lucerne, no. 1788, sold, Galerie Wimmer, Munich, private collection Bavaria;2023 amicable settlement;Read more;Read less","Luzern / Auktion, 1942/1943",amicable settlement,21.01.2019,von Trott zu Solz Lammek Rechtsanwälte Notar Phone +49 (0) 30 59 00 33 0-0 kanzlei@vontrott-lammek.de,"Freund, Julius und Clara",https://www.lostart.de/en/Verlust/581577,
2020,Portrait of a Worker Woman,,"Kollwitz, Käthe;Birth 1867.07.08, Königsberg;Death 1945.04.22, Moritzburg;Place of activity Berlin",1906,"Black chalk, charcoal: white Ingres paper / drawn",35.00 cm,"Clara and Julius Freund, Berlin, 21.03.1942 Auction at Galerie Fischer, Lucerne, No. 139, R. (?);2020 amicable settlement;(Information on purchaser's name may be provided by the declarant if necessary);Read more;Read less","Luzern / Auktion, 1942",amicable settlement,08.02.2019,von Trott zu Solz Lammek Rechtsanwälte Notar Phone +49 (0) 30 59 00 33 0-0 kanzlei@vontrott-lammek.de,"Freund, Julius und Clara",https://www.lostart.de/en/Verlust/582368,
2020,Reclining Savoyard Boy,,"Menzel, Adolph;Birth 1815.12.08, Breslau;Death 1905.02.09, Berlin;Place of activity Berlin",,pencil/black chalk: white paper / drawn,13.00 cm,"Clara and Julius Freund, Berlin, 21.03.1942 Auction at Galerie Fischer, Lucerne, No. 238;2020 amicable settlement;Read more;Read less","Luzern / Auktion, 1942",amicable settlement,08.02.2019,von Trott zu Solz Lammek Rechtsanwälte Notar Phone +49 (0) 30 59 00 33 0-0 kanzlei@vontrott-lammek.de,"Freund, Julius und Clara",https://www.lostart.de/en/Verlust/582458,
2021,Court musicians,,"Friedrich, Caspar David;Birth 1774.09.05, Greifswald;Death 1840.05.07, Dresden",1801-05-17,Washed pen drawing (Bister) / drawn,9.50 cm,"Clara and Julius Freund, Berlin, 21.03.1942 Auction at the Galerie Fischer Luzern, No. 94;2021 amicable agreement with the heirs;Read more;Read less","Luzern / Auktion, 1942",amicable settlement,08.02.2019,von Trott zu Solz Lammek Rechtsanwälte Notar Phone +49 (0) 30 59 00 33 0-0 kanzlei@vontrott-lammek.de,"Freund, Julius und Clara",https://www.lostart.de/en/Verlust/582340,
